{
    "confidence": 1.0,
    "decision": "permit",
    "evidence": [
        "team-local policy denied",
        "out of jurisdiction: org.root.teamB \u2284 org.root.teamA",
        "higher authority override",
        "override applied"
    ],
    "input_hash": "10ac1c8193e1224210a8d17c22fc81bcf545fbab6b0118860ca3b565cd4ac0cd",
    "jurisdiction": "org.root.teamA",
    "schema": "gul.inference.result/1",
    "trace": [],
    "version": "2.2.0-dev0"
}
